{
  "schema": "business-process-bpmn-questions/v1",
  "process_id": "VYDACH",
  "model_version": "0.1.0",
  "questions": [
    {
      "question_id": "Q-VYDACH-001",
      "title": "Кто является уполномоченным владельцем процесса «Выдач»?",
      "status": "open",
      "blocking": true,
      "owner_role": null,
      "source_element_ids": [
        "Process_Vydach"
      ]
    }
  ]
}
